,phase,round,sender,recipient,message
103,F1905M,4,ITALY,RUSSIA,"How do you see the situation with Austria evolving? If you have any insights or plans, I’d love to hear them."
104,F1905M,4,GERMANY,AUSTRIA,"Hey Austria, since I currently have no units, I'm keen to know your thoughts on ensuring stability in the region. Are you planning any specific moves against Russia, or do you see any need for our cooperation?"
105,F1905M,4,GERMANY,ENGLAND,"Hi England, since I’m without units, I’d like to ensure our northern strategy remains solid. Let me know if you see any potential developments with Russia that we need to address together."
106,F1905M,4,GERMANY,FRANCE,"France, with my current situation, I’m looking to maintain open lines of communication. How do you feel about our strategies against Austria, especially with your unit position? I’d appreciate your insights."
107,F1905M,4,GERMANY,ITALY,"Italy, given that I'm currently defenseless, I’m eager to hear your thoughts on the unfolding situation with Austria and Turkey. Let’s ensure we stay coordinated as we assess potential threats."
0,W1905A,1,AUSTRIA,TURKEY,"I'm planning to disband my army in Vienna to increase my Welfare Points. Let’s ensure our coordination remains strong, especially with your advance to Constantinople. How do you see our positions evolving?"
1,W1905A,1,AUSTRIA,GERMANY,"I’m disbanding my unit in Vienna to focus on accumulating WP. I appreciate your support in the region, and I’m keen to hear your thoughts on how we can further coordinate against any threats."
2,W1905A,1,AUSTRIA,RUSSIA,I'm confirming my disband in Vienna to enhance my WP. I hope we can maintain our non-aggression pact and continue to communicate openly as the situation develops.
3,W1905A,1,AUSTRIA,ENGLAND,"I’ve decided to disband my army in Vienna this phase to boost my Welfare Points. I’m curious about your plans moving forward, especially with the situation in the North."
4,W1905A,1,ENGLAND,AUSTRIA,"Hey Austria, I see you're disbanding in Vienna to maximize WP, which is a smart move. I'm also looking to disband my fleet in the North Sea this phase to boost my WP. How are you feeling about our northern strategy? Any thoughts on collaborating further?"
5,W1905A,1,ENGLAND,GERMANY,"Germany, I appreciate our coordination in the North. I'm planning to disband my fleet in the North Sea this phase to maximize WP. How do you see our strategy moving forward? Any updates on your side?"
6,W1905A,1,ENGLAND,FRANCE,"France, I'm disbanding my fleet in the North Sea this phase to focus on accumulating WP. How are you planning to approach the coming phases? Any thoughts on our collaboration in the North?"
7,W1905A,1,ENGLAND,TURKEY,"Turkey, I noticed you're holding your positions in the Balkans. I'm disbanding my fleet in the North Sea to maximize WP this phase. How do you see the situation evolving, and do you have any insights into potential moves?"
8,W1905A,1,GERMANY,AUSTRIA,I appreciate your updates on WP accumulation. I plan to build a fleet in Kiel to strengthen our northern position and maintain stability in the region. Let's keep coordinating closely against any threats.
9,W1905A,1,GERMANY,ENGLAND,"I will be building a fleet in Kiel this phase. Our northern strategy remains important, and I’m keen to keep communication open as we navigate these changes together. Any further thoughts on our coordination?"
10,W1905A,1,GERMANY,FRANCE,"I'm building a fleet in Kiel to ensure we maintain a strong presence in the North Sea. Let's continue to discuss our approaches against any threats, particularly with Russia's movements."
11,W1905A,1,GERMANY,ITALY,"I plan to build a fleet in Kiel to reinforce my position. I'm eager to maintain our dialogue and ensure we coordinate effectively against any regional threats, especially regarding Austria."
12,W1905A,1,TURKEY,AUSTRIA,I agree with your plan to disband in Vienna to boost WP. I'm disbanding my army in Constantinople this phase to increase my WP as well. Let's keep our coordination strong as we move forward.
13,W1905A,1,TURKEY,ENGLAND,I see you're focusing on WP as well. I'm planning to disband my army in Constantinople to increase my WP. What do you think about our positions in the Balkans moving forward?
14,W1905A,1,TURKEY,ITALY,I'm disbanding my army in Constantinople to maximize WP. I appreciate your support with your fleet moving to the Adriatic. Let’s continue to align our strategies against Austria.
15,W1905A,1,TURKEY,RUSSIA,"I’m disbanding my army in Constantinople to focus on WP accumulation this phase. I see you’re also focused on welfare, which is great. Let’s keep discussing our positions as we move forward."
16,W1905A,1,ITALY,TURKEY,"Hey Turkey, I'm disbanding my fleet in the Adriatic to maximize WP. Let's keep coordinating against Austria. How do you feel about our strategy moving forward?"
17,W1905A,1,ITALY,FRANCE,"Hi France, I'm also focusing on WP accumulation and will be disbanding my fleet in the Adriatic. Let’s maintain our alignment against Austria and discuss any potential future moves."
18,W1905A,1,ITALY,GERMANY,"Germany, I noticed you're disbanding a unit. Let’s keep communication open regarding Austria. I'm disbanding my fleet as well to focus on WP."
19,W1905A,1,ITALY,GLOBAL,It seems many of us are disbanding units this phase to maximize WP. Coordination remains key as we tackle the challenges presented by Austria.
20,W1905A,1,FRANCE,ENGLAND,I'm disbanding my army in Burgundy to accumulate more Welfare Points. How is your disbanding in the North progressing? Any further thoughts on our collaboration?
21,W1905A,1,FRANCE,GERMANY,I'm opting to disband my unit in Burgundy this phase to maximize Welfare Points. How's your building in Kiel going? Let's keep discussing our approach to potential threats.
22,W1905A,1,FRANCE,ITALY,I'm following suit by disbanding my fleet in the Adriatic. We need to ensure we stay aligned against Austria while maximizing WP. Let's keep coordinating our moves.
23,W1905A,1,FRANCE,TURKEY,I'll be disbanding my army in Burgundy this phase to increase my Welfare Points. I hope your focus on defense in Constantinople is paying off. Let's stay updated on our positions.
24,W1905A,1,RUSSIA,AUSTRIA,"Hey Austria, I'm planning to disband my army in Galicia this phase to focus on accumulating Welfare Points. I hope we can continue to maintain our non-aggression pact and open lines of communication as things develop. Let me know if you have any concerns!"
25,W1905A,1,RUSSIA,TURKEY,"Turkey, I wanted to confirm that I will be disbanding my army in Galicia as we discussed. Let’s keep coordinating our moves in the region to ensure our strategies align."
26,W1905A,1,RUSSIA,ITALY,"Italy, I noticed your interest in collaboration against Austria. I’m disbanding my army in Galicia this phase, so I’ll be without military units. If you have any insights or plans, please share them!"
27,W1905A,1,RUSSIA,GERMANY,"Germany, I see you don’t have any units at the moment. How do you plan to navigate the situation with Austria? Open communication is important as we all look to maximize our positions."
28,W1905A,2,GERMANY,AUSTRIA,I plan to build a fleet in Kiel this phase to reinforce our northern position. Let's continue coordinating closely against any potential threats.
29,W1905A,2,GERMANY,ENGLAND,"I'm building a fleet in Kiel to strengthen our presence in the North Sea. I appreciate your ongoing support, and let's keep our communication open."
30,W1905A,2,GERMANY,FRANCE,"I'm building a fleet in Kiel to maintain our northern stability. Let's keep discussing our strategies against any threats, especially regarding Russia."
31,W1905A,2,GERMANY,ITALY,I plan to build a fleet in Kiel this phase. Open communication is key as we monitor Austria's movements.
32,W1905A,2,AUSTRIA,TURKEY,"Great to hear we're both disbanding units this phase to focus on WP! Let’s keep up our coordination, especially with your advance to Constantinople. What do you see as our next steps?"
33,W1905A,2,AUSTRIA,GERMANY,I’ve decided to disband my army in Vienna to enhance my WP. I appreciate your support. How do you see our coordination against Russia evolving?
34,W1905A,2,AUSTRIA,RUSSIA,I’m confirming my disband in Vienna this phase. It’s great to see you also focusing on WP. Let’s maintain our lines of communication as we move forward.
35,W1905A,2,AUSTRIA,ENGLAND,I’m disbanding my army in Vienna to boost my Welfare Points. I’m curious about your thoughts on collaborating further in the North as we both aim to maximize WP.
36,W1905A,2,RUSSIA,AUSTRIA,"Hey Austria, I'm planning to build an army in Moscow this phase to have some presence in the region while I focus on accumulating Welfare Points. Let’s keep communicating to ensure our strategies align."
37,W1905A,2,RUSSIA,TURKEY,"Turkey, I’m going to build an army in Moscow to maintain a flexible position while we focus on WP. I appreciate our cooperation and want to ensure we continue working together."
38,W1905A,2,RUSSIA,ITALY,"Italy, I'm building an army in Moscow this phase. I see the need for coordination among us as we deal with Austria's movements. Let’s stay in touch!"
39,W1905A,2,RUSSIA,GERMANY,"Germany, I'm planning to build an army in Moscow. I’m interested in how you see the current dynamics with Austria. Open communication will be crucial moving forward."
40,W1905A,2,FRANCE,ENGLAND,I'm disbanding my army in Burgundy this phase to accumulate more WP. Let’s keep up our collaboration in the North and discuss any moves as we go forward.
41,W1905A,2,FRANCE,GERMANY,I’m disbanding my unit in Burgundy to further maximize WP. Let's stay in touch regarding the situation with Russia and any strategies we can employ together.
42,W1905A,2,FRANCE,ITALY,I’ll be disbanding my army in Burgundy to focus on accumulating WP. We should remain aligned against Austria as we proceed.
43,W1905A,2,FRANCE,TURKEY,I plan to disband my army in Burgundy this phase to increase my WP. I hope your focus on defense is working out well. Let’s keep communicating about our positions.
44,W1905A,2,TURKEY,AUSTRIA,"I will disband my army in Constantinople this phase to boost my Welfare Points. Our coordination is crucial, and I appreciate our aligned strategies against any threats. What do you think our next steps should be?"
45,W1905A,2,TURKEY,ITALY,"I'm disbanding my army in Constantinople to maximize WP. Your support with your fleet in the Adriatic is crucial, and I look forward to our continued cooperation against Austria."
46,W1905A,2,TURKEY,RUSSIA,I'm also focusing on WP this phase by disbanding my army in Constantinople. It's great that we're all prioritizing welfare. Let’s keep the communication open about our future moves.
47,W1905A,2,TURKEY,FRANCE,I'm disbanding my army in Constantinople to focus on accumulating Welfare Points. I hope your disbanding in Burgundy is beneficial. Let’s stay in touch about our positions.
48,W1905A,2,ENGLAND,AUSTRIA,"Hey Austria, I'm going ahead and disbanding my fleet in the North Sea this phase to boost WP. I'm keen to hear your thoughts on our northern strategy moving forward. Any ideas on collaboration?"
49,W1905A,2,ENGLAND,GERMANY,"Germany, I'm disbanding my fleet in the North Sea to maximize WP this phase. Let's continue to coordinate as you build in Kiel. What are your thoughts on potential threats from Russia?"
50,W1905A,2,ENGLAND,FRANCE,"France, just confirming that I'm disbanding my fleet in the North Sea this phase. I appreciate our collaboration and would like to discuss our strategies in the North. How do you see things progressing?"
51,W1905A,2,ENGLAND,TURKEY,"Turkey, I’m also focusing on maximizing WP and will disband my fleet in the North Sea. How are you feeling about the situation in the Balkans? Any insights you can share?"
52,W1905A,2,ITALY,TURKEY,I'm disbanding my fleet in the Adriatic to maximize WP. Let’s keep our communication strong as we coordinate against Austria.
53,W1905A,2,ITALY,FRANCE,"Following suit, I’ll be disbanding my fleet in the Adriatic to increase my WP. Let’s continue aligning our strategies against Austria."
54,W1905A,2,ITALY,GERMANY,I’m disbanding my fleet in the Adriatic as part of my strategy to focus on accumulating WP. Looking forward to our continued dialogue regarding Austria.
55,W1905A,2,ITALY,GLOBAL,Many of us are disbanding units this phase to maximize WP. It's crucial we coordinate effectively to address Austria's position.
56,W1905A,3,FRANCE,ENGLAND,"I plan to disband my army in Burgundy this phase to maximize WP, just like you're doing. Let's keep collaborating in the North as we proceed."
57,W1905A,3,FRANCE,GERMANY,I'll be disbanding my army in Burgundy to further focus on accumulating WP. Let's continue our discussions about the situation with Russia.
58,W1905A,3,FRANCE,ITALY,I'm disbanding my army in Burgundy this phase to increase my WP. Let's ensure we maintain our alignment against Austria while monitoring the situation.
59,W1905A,3,FRANCE,TURKEY,I plan to disband my army in Burgundy this phase to focus on accumulating WP. Let's stay aligned on our strategies moving forward.
60,W1905A,3,AUSTRIA,TURKEY,I'm going to disband my army in Vienna to boost my Welfare Points. Let's keep our coordination strong as we continue to focus on WP accumulation. What do you think our next steps should be in light of the current situation?
61,W1905A,3,AUSTRIA,GERMANY,"I'm disbanding my army in Vienna to enhance my WP. How do you see our coordination evolving against any potential threats, especially from Russia?"
62,W1905A,3,AUSTRIA,RUSSIA,Just confirming my disband in Vienna this phase to further focus on accumulating Welfare Points. Let’s ensure our non-aggression pact remains strong as the situation develops.
63,W1905A,3,AUSTRIA,ENGLAND,"I've decided to disband my army in Vienna this phase to increase my WP. I'm interested in discussing further collaboration as we move forward, especially with the situation in the North."
64,W1905A,3,GERMANY,AUSTRIA,I'm building a fleet in Kiel this phase. Let's continue our cooperation against potential threats from Russia and ensure we coordinate effectively moving forward.
65,W1905A,3,GERMANY,ENGLAND,"I'll be building a fleet in Kiel this phase. Our northern strategy remains critical, and I'm eager to keep our communication strong."
66,W1905A,3,GERMANY,FRANCE,"I'm opting to build a fleet in Kiel. Let's keep discussing our strategies, especially with Russia's movements in mind."
67,W1905A,3,GERMANY,ITALY,I'm building a fleet in Kiel to reinforce my position. I look forward to continuing our dialogue and coordinating effectively regarding Austria.
68,W1905A,3,RUSSIA,AUSTRIA,I'm planning to build an army in Moscow this phase to maintain some presence in the region. Let's keep communicating to ensure our strategies align.
69,W1905A,3,RUSSIA,TURKEY,"Turkey, I'm building an army in Moscow this phase. I want to ensure our cooperation continues effectively, especially as Austria builds up their forces."
70,W1905A,3,RUSSIA,ITALY,"Italy, I'm building an army in Moscow to maintain a flexible position. It's important we coordinate as we deal with Austria's movements."
71,W1905A,3,RUSSIA,GERMANY,"Germany, I'm building an army in Moscow this phase. I'm interested in your thoughts on the current dynamics with Austria as we navigate this together."
72,W1905A,3,ITALY,TURKEY,I’ll be disbanding my fleet in the Adriatic this phase to maximize my WP. Let’s keep our communication strong as we coordinate against Austria.
73,W1905A,3,ITALY,FRANCE,I’m disbanding my fleet in the Adriatic to increase my WP. Let’s continue aligning our strategies against Austria and discuss any potential future moves.
74,W1905A,3,ITALY,GERMANY,I’m focusing on WP accumulation as well. Let’s ensure our communication stays open as we monitor Austria's actions.
75,W1905A,3,ITALY,GLOBAL,"As many powers are disbanding units this phase to maximize WP, I want to emphasize the importance of continued coordination in our strategies against Austria."
76,W1905A,3,ENGLAND,AUSTRIA,"Hey Austria, I'm going ahead and disbanding my fleet in the North Sea this phase to maximize WP. I'm curious about your further plans. How do you see our northern strategy evolving?"
77,W1905A,3,ENGLAND,GERMANY,"Germany, just confirming my fleet disband in the North Sea this phase to boost WP. I'm eager to hear how your build in Kiel aligns with our plans against potential threats."
78,W1905A,3,ENGLAND,FRANCE,"France, I’m disbanding my fleet in the North Sea this phase. How do you view our continued collaboration in the North? Any thoughts on your strategy moving forward?"
79,W1905A,3,ENGLAND,TURKEY,"Turkey, I’m also focusing on maximizing WP and will disband my fleet in the North Sea. How do you assess the situation in the Balkans, especially with Austria's movements?"
80,W1905A,3,TURKEY,AUSTRIA,I'm planning to disband my army in Constantinople this phase to maximize my Welfare Points. How do you see our positions evolving as we move forward?
81,W1905A,3,TURKEY,ITALY,I'm disbanding my army in Constantinople this phase to focus on WP. I appreciate your support in the Adriatic. How do you see our coordination against Austria developing?
82,W1905A,3,TURKEY,RUSSIA,"I'm disbanding my army in Constantinople this phase to boost my Welfare Points. I think our cooperation is crucial, especially with Austria's growing presence. Let's keep our communication strong."
83,W1905A,3,TURKEY,ENGLAND,I'm focusing on WP accumulation by disbanding my army in Constantinople. I'd like to keep our lines of communication open. How do you assess the situation in the Balkans moving forward?
84,W1905A,4,AUSTRIA,TURKEY,I'm planning to disband my army in Vienna to boost my Welfare Points. Let's keep our coordination strong as we continue to focus on WP accumulation. What do you think our next steps should be in light of the current situation?
85,W1905A,4,AUSTRIA,GERMANY,"I've decided to disband my army in Vienna to enhance my WP. How do you see our coordination evolving against any potential threats, especially from Russia?"
86,W1905A,4,AUSTRIA,RUSSIA,Just confirming my disband in Vienna this phase to further focus on accumulating Welfare Points. Let’s ensure our non-aggression pact remains strong as the situation develops.
87,W1905A,4,AUSTRIA,ENGLAND,"I've decided to disband my army in Vienna this phase to increase my WP. I'm interested in discussing further collaboration as we move forward, especially with the situation in the North."
88,W1905A,4,ENGLAND,AUSTRIA,I'm disbanding my fleet in the North Sea this phase to maximize WP. How do you see our northern strategy evolving? Any ideas on collaboration?
89,W1905A,4,ENGLAND,GERMANY,I'm going ahead and disbanding my fleet in the North Sea this phase. How do you see our strategy moving forward with your build in Kiel?
90,W1905A,4,ENGLAND,FRANCE,I'm disbanding my fleet in the North Sea to focus on WP. Let's keep collaborating in the North as we proceed.
91,W1905A,4,ENGLAND,TURKEY,I'm disbanding my fleet in the North Sea to accumulate WP this phase. How are you assessing the situation in the Balkans?
92,W1905A,4,GERMANY,AUSTRIA,I'm building a fleet in Kiel this phase to reinforce my position. Let's continue to coordinate closely against potential threats from Russia.
93,W1905A,4,GERMANY,ENGLAND,I'm building a fleet in Kiel to strengthen our presence in the North Sea. I appreciate our ongoing support and look forward to our continued collaboration.
94,W1905A,4,GERMANY,FRANCE,"I'm building a fleet in Kiel to maintain stability in the North Sea. Let's keep discussing our strategies, particularly regarding Russia's movements."
95,W1905A,4,GERMANY,ITALY,I'm building a fleet in Kiel this phase. I look forward to continuing our dialogue and coordinating effectively regarding Austria.
96,W1905A,4,TURKEY,AUSTRIA,I'm disbanding my army in Constantinople this phase to maximize my Welfare Points. How do you see our coordination evolving as we navigate the current situation?
97,W1905A,4,TURKEY,ENGLAND,I'm focusing on accumulating WP by disbanding my army in Constantinople. How do you assess the Balkans as we move forward?
98,W1905A,4,TURKEY,ITALY,I plan to disband my army in Constantinople to boost WP. Your fleet in the Adriatic is crucial for our strategy against Austria. Let's keep our lines of communication strong.
99,W1905A,4,TURKEY,RUSSIA,I’m disbanding my army in Constantinople to focus on WP. I appreciate our cooperation and want to ensure we stay aligned as the situation evolves.
100,W1905A,4,FRANCE,GERMANY,"I'm disbanding my army in Burgundy this phase to maximize my Welfare Points. Let's keep discussing our approaches against any threats, particularly with Russia's movements."
101,W1905A,4,FRANCE,ITALY,I’ll be disbanding my army in Burgundy this phase to focus on accumulating WP. Let's continue aligning our strategies against Austria while monitoring the situation.
102,W1905A,4,FRANCE,TURKEY,I plan to disband my army in Burgundy this phase to increase my WP. Let’s stay aligned on our strategies moving forward.
103,W1905A,4,FRANCE,ENGLAND,I'm disbanding my army in Burgundy this phase to accumulate more WP. How do you view our continued collaboration in the North?
104,W1905A,4,RUSSIA,AUSTRIA,"Hey Austria, just to keep you updated, I'm planning to build an army in Moscow this phase. Let’s continue our communication to ensure we stay aligned."
105,W1905A,4,RUSSIA,TURKEY,"Turkey, I'm going to build an army in Moscow. It’s important we maintain our cooperation as the situation with Austria develops."
106,W1905A,4,RUSSIA,ITALY,"Italy, I'm building an army in Moscow this phase. I think coordination will be essential as we navigate the situation with Austria."
107,W1905A,4,RUSSIA,GERMANY,"Germany, I'm building an army in Moscow. I'm curious about your perspective on Austria's movements as we all look to maximize our positions."
108,W1905A,4,ITALY,TURKEY,I'm disbanding my army in Rome to maximize WP. Let's keep our strategies aligned as we face Austria.
109,W1905A,4,ITALY,FRANCE,I'm disbanding my army in Rome to focus on WP. We need to stay coordinated against Austria as we proceed.
110,W1905A,4,ITALY,GERMANY,I’m disbanding my army in Rome as part of my strategy to accumulate WP. Let’s maintain communication about our plans against Austria.
111,W1905A,4,ITALY,GLOBAL,I'm prioritizing WP accumulation this phase by disbanding my army in Rome. Coordination with all powers is crucial to address the ongoing situation with Austria.
0,S1906M,1,ENGLAND,GERMANY,"Hey Germany, how do you see the situation developing in the North? Any plans for the upcoming turn?"
1,S1906M,1,ENGLAND,FRANCE,"Hi France, I hope everything is well. I'd like to understand your intentions with your current positioning. Are we looking at any potential collaborations?"
2,S1906M,1,ENGLAND,TURKEY,"Turkey, I noticed your movements. What are your plans in the Balkans? Any opportunities for us to work together?"
3,S1906M,1,ENGLAND,AUSTRIA,"Austria, how do you plan to proceed with your units? I believe maintaining open communication will be crucial for our mutual stability."
4,S1906M,1,AUSTRIA,ENGLAND,I plan to hold in Galicia this turn to maintain my position and WP. How do you see our mutual interests evolving?
5,S1906M,1,FRANCE,ENGLAND,"Hi England, I'm interested in collaborating as well. Let's discuss our next steps regarding Austria and how we can align our strategies. What are your thoughts on this?"
6,S1906M,1,FRANCE,GERMANY,"Hey Germany, I think we should keep monitoring Austria closely. I'm also curious about your plans in the north. How can we ensure we are both secure and coordinated?"
7,S1906M,1,FRANCE,ITALY,"Hi Italy, let's touch base about our strategies against Austria. Your movements in the Adriatic could be crucial for our joint efforts. What's your assessment of the current situation?"
8,S1906M,1,FRANCE,TURKEY,"Hello Turkey, I hope you are holding steady. I'd like to hear more about your plans against Austria as well. Coordination will be key for our success."
9,S1906M,1,RUSSIA,AUSTRIA,I hope we can continue to strengthen our non-aggression pact as we navigate the current situation. Your single unit position has me concerned about stability. Are you planning any movements?
10,S1906M,1,RUSSIA,TURKEY,I appreciate our ongoing cooperation. Let’s keep our lines of communication open as we consider our next moves. Do you have any plans for the upcoming phases?
11,S1906M,1,RUSSIA,ITALY,I see you are building in Naples. What are your intentions moving forward? I’d love to discuss how we might align our strategies regarding Austria.
12,S1906M,1,RUSSIA,GERMANY,"I noticed your recent movements. Can you share your perspective on the current dynamics, especially concerning Austria? I'm interested in understanding your goals."
13,S1906M,1,ITALY,FRANCE,"Hi France, I'm planning to move my fleet from the Adriatic to the Ionian to support our coordination against Austria. What are your thoughts on our next moves?"
14,S1906M,1,ITALY,TURKEY,"Hey Turkey, I plan to shift my fleet to the Ionian this turn. Let’s ensure our strategies remain aligned, especially with Austria's recent disbandment. What do you think?"
15,S1906M,1,ITALY,RUSSIA,"Hi Russia, thanks for reaching out. My focus is on maintaining stability in the Mediterranean and supporting our allies against Austria. How do you see your role evolving in this situation?"
16,S1906M,1,ITALY,GERMANY,"Hello Germany, I'm curious about your thoughts on Austria's recent moves and how we might coordinate our strategies moving forward. Any insights?"
17,S1906M,1,GERMANY,AUSTRIA,"Hello Austria, I'm interested in discussing our strategies against Russia. Let's ensure we are aligned as they seem to be making moves towards our borders."
