,phase,round,sender,recipient,message
24,F1908M,1,AUSTRIA,TURKEY,"I appreciate your reassurance about your defensive movements, and I want to emphasize that my intentions in Rumania are aimed at ensuring stability as well. Let's keep our lines of communication open."
25,F1908M,1,AUSTRIA,GERMANY,"I'm committed to maintaining alignment against any potential threats, especially with Turkey. Let’s keep discussing our strategies to ensure we're prepared."
26,F1908M,1,AUSTRIA,RUSSIA,Thank you for reaffirming our non-aggression pact. I hope we can continue to coordinate effectively as we both face challenges from other powers.
27,F1908M,1,AUSTRIA,ENGLAND,"I understand your concerns regarding my position in Rumania. I assure you my intentions are not aggressive, and I value our dialogue to ensure mutual interests are respected."
28,F1908M,2,FRANCE,ITALY,I'm currently unitless but focused on our collective efforts against Austria. I support your plans and hope to hear more about your strategies.
29,F1908M,2,FRANCE,TURKEY,I agree on the importance of cooperation against Austria. I'm currently unitless but eager to hear more about your thoughts on our strategies moving forward.
30,F1908M,2,FRANCE,GERMANY,"As I have no units this turn, I am focusing on our communications regarding Austria. Let’s keep the coordination tight."
31,F1908M,2,FRANCE,ENGLAND,I appreciate your focus on coordination against Austria. I'm currently without units but committed to our collaborative efforts.
32,F1908M,2,ENGLAND,FRANCE,I appreciate our collaboration against Austria and want to ensure we stay aligned. Let's keep communication open as we navigate the challenges ahead.
33,F1908M,2,ENGLAND,GERMANY,I value our ongoing dialogue and support against Austria. Let's keep each other updated on any developments.
34,F1908M,2,ENGLAND,TURKEY,"Your updates on the Balkans are crucial, and I want to ensure we’re synchronized in our strategies against Austria."
35,F1908M,2,ENGLAND,AUSTRIA,"I acknowledge your recent movements, and I hope we can continue to communicate effectively. However, I'm still concerned about your intentions and the need for mutual respect."
36,F1908M,2,ITALY,TURKEY,I'm moving my fleet to the Adriatic to support your advance into Albania. Please let me know if there are any additional plans or support you need!
37,F1908M,2,ITALY,GERMANY,"I'm holding in the Adriatic, supporting Turkey's advance. Let's keep communication open regarding Austria's next moves."
38,F1908M,2,ITALY,FRANCE,"I'm currently supporting Turkey's move into Albania. If you have any updates on your situation or strategies, please share!"
39,F1908M,2,ITALY,RUSSIA,I'm focused on aligning our strategies against Austria and moving my fleet to the Adriatic. Do you have any insights on Austria's intentions?
40,F1908M,2,AUSTRIA,TURKEY,I want to reassure you that my hold in Rumania is to maintain stability in the region and not an aggressive move. Let’s keep communicating to ensure our mutual interests are respected.
41,F1908M,2,AUSTRIA,GERMANY,I'm holding in Rumania to consolidate our position and ensure stability in the Balkans. Let's continue our discussions on aligning strategies against potential threats.
42,F1908M,2,AUSTRIA,RUSSIA,I appreciate our non-aggression pact and want to confirm that my hold in Rumania is in line with our agreement to maintain peace.
43,F1908M,2,AUSTRIA,ENGLAND,I understand your concerns about my position in Rumania. I assure you my intentions are to maintain stability and I value our dialogue to respect mutual interests.
44,F1908M,2,RUSSIA,TURKEY,"Turkey, I'm moving my army from Ukraine to Galicia this turn to strengthen our position against Austria. Let’s keep coordinating our efforts!"
45,F1908M,2,RUSSIA,ITALY,"Italy, I'm moving to Galicia this turn. I believe this will strengthen our position against Austria. How are you planning to proceed?"
46,F1908M,2,RUSSIA,AUSTRIA,"Austria, I am moving to Galicia this turn to assert my presence in the region. I hope we can continue to maintain our non-aggression pact."
47,F1908M,2,RUSSIA,GERMANY,"Germany, I'm shifting my army to Galicia this turn. I'd like to understand your thoughts on the situation with Austria as tensions rise."
48,F1908M,2,GERMANY,AUSTRIA,"Austria, I see your movement to Rumania. Let’s ensure we maintain clear communication to prevent misunderstandings as we navigate this situation."
49,F1908M,2,GERMANY,ENGLAND,"England, I'm holding in Kiel to keep our northern strategy stable. Let's continue to share updates on our movements and align our strategies."
50,F1908M,2,GERMANY,ITALY,"Italy, I'm currently holding in Kiel. Let's keep the communication open regarding our next steps and align our approaches to Austria's actions."
51,F1908M,2,GERMANY,TURKEY,"Turkey, I appreciate your emphasis on cooperation against Austria. I’m holding in Kiel for now as we strategize together."
52,F1908M,2,TURKEY,ITALY,Thanks for the fleet support into Albania! I'm moving my army to Rumania this turn to secure the position. Let me know if you need anything else!
53,F1908M,2,TURKEY,RUSSIA,I'm moving my army to Rumania this turn. Thanks for holding in Ukraine; let’s ensure our strategies remain aligned against Austria.
54,F1908M,2,TURKEY,AUSTRIA,"I see you’re moving to Rumania too. Just to reiterate, my intentions are defensive, and I'm committed to maintaining stability."
55,F1908M,2,TURKEY,GLOBAL,I hope everyone is on the same page regarding Austria's actions. Let’s keep up the communication to ensure our strategies align.
56,F1908M,3,ENGLAND,FRANCE,"I appreciate our ongoing coordination against Austria. While I currently have no units, I want to ensure we're aligned in our strategies moving forward."
57,F1908M,3,ENGLAND,GERMANY,Your updates and support in the north are invaluable. Let's keep our lines of communication open as we navigate Austria's rising power.
58,F1908M,3,ENGLAND,TURKEY,It's crucial that we remain synchronized regarding Austria's movements. I'm here to support our alliance and share insights.
59,F1908M,3,ENGLAND,AUSTRIA,"I acknowledge your recent actions and appreciate our dialogue. However, I hope we can maintain open communication to ensure mutual interests are respected."
60,F1908M,3,FRANCE,ITALY,I support your move into Albania and would love to hear more about how you see our strategies aligning against Austria.
61,F1908M,3,FRANCE,TURKEY,I’m unitless this turn but keen to stay in sync regarding Austria. How do you see our cooperation shaping up?
62,F1908M,3,FRANCE,GERMANY,Let’s keep our coordination tight as we prepare for Austria’s next moves. I’m eager to hear your thoughts on our next steps.
63,F1908M,3,FRANCE,ENGLAND,"I appreciate our ongoing collaboration. While I have no units, I'm committed to staying aligned with our strategies against Austria."
64,F1908M,3,ITALY,TURKEY,"I’m moving my fleet to the Adriatic to support your advance into Albania. If you need anything else or have further plans, please let me know!"
65,F1908M,3,ITALY,GERMANY,I’m moving my fleet to the Adriatic to support Turkey's advance. Let's stay aligned in our strategies against Austria.
66,F1908M,3,ITALY,FRANCE,I’m moving my fleet to the Adriatic to support Turkey. How are you positioning yourself against Austria?
67,F1908M,3,ITALY,RUSSIA,I’m moving to the Adriatic to support Turkey's advance. What insights do you have about Austria's movements?
68,F1908M,3,RUSSIA,TURKEY,I will move my army from Ukraine to Galicia this turn to support our position against Austria. Let's keep up our coordination!
69,F1908M,3,RUSSIA,ITALY,I'm moving my army to Galicia this turn to strengthen our stance against Austria. How do you see your movements aligning with ours?
70,F1908M,3,RUSSIA,AUSTRIA,"Just to keep you informed, I'm moving to Galicia this turn. I hope we can maintain our non-aggression pact despite the tensions."
71,F1908M,3,RUSSIA,GERMANY,"I'm shifting my army to Galicia this turn. What are your thoughts on the situation with Austria, and how do you plan to navigate this?"
72,F1908M,3,GERMANY,AUSTRIA,"Austria, I will hold in Kiel this turn. Let’s keep discussing our strategies to ensure we are aligned against potential threats."
73,F1908M,3,GERMANY,ENGLAND,"England, I’m holding in Kiel. Let’s continue to coordinate our northern strategy and keep each other updated on any developments."
74,F1908M,3,GERMANY,ITALY,"Italy, I’m holding in Kiel. It’s important we keep our communication open regarding Austria’s next moves."
75,F1908M,3,GERMANY,TURKEY,"Turkey, I’m holding in Kiel as we strategize together. Let’s make sure we are all aligned against any potential aggression from Austria."
76,F1908M,3,TURKEY,AUSTRIA,I see your move to Rumania is defensive as well. Let's continue to communicate to ensure our mutual interests are respected.
77,F1908M,3,TURKEY,ITALY,Thanks for the fleet support! I'm moving my army to Rumania this turn. Let's keep coordinating our efforts.
78,F1908M,3,TURKEY,RUSSIA,I'm moving to Rumania this turn. Let's ensure our strategies remain aligned against Austria.
79,F1908M,3,TURKEY,GLOBAL,I hope everyone is aligned in their strategies against Austria. Maintaining strong communication is vital.
80,F1908M,3,AUSTRIA,TURKEY,"I want to reassure you that my hold in Rumania is defensive, and I appreciate your commitment to stability in the region. Let’s keep communicating to ensure our mutual interests are respected."
81,F1908M,3,AUSTRIA,GERMANY,"I am holding in Rumania to maintain stability and avoid escalating tensions. Let’s continue our dialogue to align our strategies, especially with Russia's movements."
82,F1908M,3,AUSTRIA,RUSSIA,I hope we can maintain our non-aggression pact despite your move to Galicia. My hold in Rumania is to reinforce our agreement and ensure regional stability.
83,F1908M,3,AUSTRIA,ENGLAND,"I understand your concerns about my hold in Rumania, but I assure you my intentions are to maintain stability and not aggressive expansion. Let’s keep the lines of communication open."
84,F1908M,4,AUSTRIA,TURKEY,I want to reassure you that my hold in Rumania is purely defensive and aimed at maintaining stability in the region. Let's continue to communicate openly.
85,F1908M,4,AUSTRIA,GERMANY,I plan to hold in Rumania to ensure stability amidst rising tensions. Let's keep discussing our strategies to align effectively.
86,F1908M,4,AUSTRIA,RUSSIA,I hope my hold in Rumania reinforces our non-aggression pact. I appreciate your understanding as we navigate the current situation.
87,F1908M,4,AUSTRIA,ENGLAND,I assure you my intentions in Rumania are not aggressive. I value our dialogue and hope we can continue to maintain mutual respect.
88,F1908M,4,FRANCE,GERMANY,I appreciate your updates on the situation. Let's continue to ensure our strategies against Austria are tightly coordinated.
89,F1908M,4,FRANCE,ITALY,I'm supporting your efforts against Austria and would love to hear more about your plans in the Adriatic.
90,F1908M,4,FRANCE,TURKEY,It's vital that we keep communication strong. How do you see our cooperation shaping up as we face Austria?
91,F1908M,4,FRANCE,ENGLAND,"I value our ongoing collaboration against Austria. While I'm unitless, I'm committed to staying aligned with our strategies."
92,F1908M,4,GERMANY,AUSTRIA,I will be moving my army to Berlin this turn to strengthen my position. Let's ensure our communications remain clear to navigate the current tensions effectively.
93,F1908M,4,GERMANY,ENGLAND,I plan to move my army to Berlin to maintain stability in the north. Your continued support is appreciated as we monitor Austria's movements.
94,F1908M,4,GERMANY,ITALY,I’m moving my army to Berlin for strategic positioning. Let’s keep our communication open regarding Austria's next moves and align our strategies.
95,F1908M,4,GERMANY,TURKEY,"I'm moving my army to Berlin this turn. I appreciate your emphasis on cooperation against Austria, and I'm eager to hear any updates from you."
96,F1908M,4,ENGLAND,AUSTRIA,"I acknowledge your recent moves, but I want to reiterate the importance of our communication regarding Austria's actions. I'm still concerned about your intentions and hope we can continue to respect each other's interests."
97,F1908M,4,ENGLAND,TURKEY,Your updates on the Balkans are critical. I believe we need to keep our strategies aligned as we approach the upcoming phases.
98,F1908M,4,ENGLAND,GERMANY,"Let’s ensure we keep coordinating our efforts in the North. Your moves have been solid, and I’m here to support our joint strategy."
99,F1908M,4,ENGLAND,FRANCE,"I appreciate your commitment to our collaboration against Austria. Although I currently have no units, I'm focused on ensuring we remain aligned in our strategies."
100,F1908M,4,RUSSIA,AUSTRIA,I hope my move to Galicia reinforces our non-aggression pact. I'm committed to maintaining stability in the region despite the rising tensions.
101,F1908M,4,RUSSIA,TURKEY,I'm moving my army to Galicia this turn to support our position against Austria. Let's ensure our strategies remain aligned.
102,F1908M,4,RUSSIA,ITALY,"I'm moving to Galicia this turn, aiming to strengthen our stance against Austria. How are your movements shaping up, and do you have any further insights?"
103,F1908M,4,RUSSIA,GERMANY,"I'm shifting my army to Galicia this turn. Given Austria's buildup, I’d like to hear your thoughts on how we can maintain stability in the region."
104,F1908M,4,ITALY,TURKEY,I'm moving my fleet from APU to the Adriatic to support your advance into Albania. Let me know if there are any further plans or if you need additional support!
105,F1908M,4,ITALY,GERMANY,I’m moving my fleet to the Adriatic to provide support for Turkey. Let's stay aligned in our strategies against Austria.
106,F1908M,4,ITALY,FRANCE,"I'm focusing on supporting Turkey's move into Albania. If you have any updates or insights regarding Austria, please share!"
107,F1908M,4,ITALY,RUSSIA,I’m moving my fleet to the Adriatic to back Turkey. How do you see our positions aligning against Austria?
108,F1908M,4,TURKEY,ITALY,"Thanks for your fleet support into Albania! I plan to move my army to Rumania this turn. If you have any further plans or support you need, just let me know!"
109,F1908M,4,TURKEY,RUSSIA,I'm moving my army to Rumania this turn. Let's ensure we remain aligned against Austria's potential aggression.
110,F1908M,4,TURKEY,AUSTRIA,I see your move to Rumania is defensive as well. Let's continue to communicate to ensure our mutual interests are respected.
111,F1908M,4,TURKEY,GLOBAL,It's crucial that we maintain open lines of communication and cooperation as we face potential aggression from Austria together.
0,W1908A,1,ENGLAND,GERMANY,I’m planning to build a fleet in Edinburgh to strengthen our northern presence. How are you viewing your situation with Austria?
1,W1908A,1,ENGLAND,TURKEY,I’m considering building a fleet in Edinburgh this phase to maintain a strategic position in the North Sea. Let’s keep communication open as we navigate the threats from Austria.
2,W1908A,1,ENGLAND,AUSTRIA,I recognize your recent movements and am hoping to maintain open dialogue. I'm building a fleet in Edinburgh to enhance my strategic options. How do you view our current positioning?
3,W1908A,1,ENGLAND,FRANCE,I’m looking to build a fleet in Edinburgh to support our northern strategies. I hope we can continue our cooperation against potential threats from Austria.
4,W1908A,1,RUSSIA,AUSTRIA,I want to reassure you that my disbanding in Galicia is a strategic decision aimed at accumulating Welfare Points. I value our non-aggression pact and wish to maintain stability in the region.
5,W1908A,1,RUSSIA,TURKEY,I plan to disband my army in Galicia to focus on Welfare Points. Let's continue coordinating our strategies against Austria's movements. Your support in the region is essential.
6,W1908A,1,RUSSIA,ITALY,I’m disbanding my army in Galicia this phase to maximize my Welfare Points. I hope we can stay aligned in our approaches towards Austria as the situation evolves.
7,W1908A,1,RUSSIA,GERMANY,I noticed your movements and wanted to touch base regarding Austria's buildup. I'm aiming for stability in the region and would appreciate your thoughts on the current dynamics.
8,W1908A,1,GERMANY,AUSTRIA,"Hey Austria, I’m disbanding my army in Berlin this winter to maximize my Welfare Points. Let’s keep up our communication regarding your moves. Your buildup is noted, and I’m keen to discuss how we can maintain stability in the region."
9,W1908A,1,GERMANY,ENGLAND,I’m planning to disband my army in Berlin this winter to focus on accumulating WP. How’s your fleet build going in Edinburgh? Let’s coordinate closely in the North.
10,W1908A,1,GERMANY,RUSSIA,"Thanks for reaching out, Russia. I’m disbanding my army in Berlin to enhance my WP. Your observations on Austria’s actions are welcome, and I’d like to hear more about your intentions in Galicia."
11,W1908A,1,GERMANY,ITALY,I’m going to disband my army in Berlin this winter to accumulate more WP. How’s your fleet build in Naples looking? Let’s keep discussing our approaches to Austria.
12,W1908A,1,ITALY,TURKEY,I will be disbanding my fleet in the Adriatic this phase to maximize WP. Let's continue coordinating against Austria.
13,W1908A,1,ITALY,GERMANY,I'm planning to disband my fleet in the Adriatic this phase to accumulate more WP. I hope we can keep discussing our approaches to Austria.
14,W1908A,1,ITALY,FRANCE,I’m focusing on disbanding my fleet in the Adriatic this phase to boost my WP. Let’s keep our strategies aligned against Austria.
15,W1908A,1,ITALY,RUSSIA,I’m disbanding my fleet in the Adriatic this phase to maximize my WP. I hope we can stay aligned in our approaches towards Austria.
16,W1908A,1,AUSTRIA,TURKEY,I’m building an army in Budapest this phase to enhance my position in the Balkans. I appreciate our continued communication as we navigate the regional dynamics.
17,W1908A,1,AUSTRIA,GERMANY,I’m building an army in Budapest. Let's keep discussing our strategies against any potential threats. Your support is crucial.
18,W1908A,1,AUSTRIA,RUSSIA,I'm building an army in Budapest to ensure stability in the region. Our non-aggression pact remains a priority for me.
19,W1908A,1,AUSTRIA,ENGLAND,"Just a heads-up, I’m building an army in Budapest this phase. I value our open communication and look forward to our continued dialogue."
20,W1908A,1,FRANCE,ITALY,I see you're disbanding your fleet in the Adriatic. I plan to build an army in Marseille this phase. Let's continue to align our strategies against Austria.
21,W1908A,1,FRANCE,TURKEY,I’m building an army in Marseille this phase. We need to stay coordinated against Austria’s potential aggression.
22,W1908A,1,FRANCE,GERMANY,I'm looking to maintain our communication as I build in Marseille this phase. Let’s keep an eye on Austria together.
23,W1908A,1,FRANCE,ENGLAND,I noticed you're planning to build a fleet in Edinburgh. I'll be building an army in Marseille. Let's keep working together against any threats.
24,W1908A,1,TURKEY,AUSTRIA,I see you're building in Budapest. Let's ensure we maintain our communication to avoid misunderstandings as we navigate the dynamics in the Balkans.
25,W1908A,1,TURKEY,ITALY,"Thanks for your continued support. With your fleet in the Adriatic and my plans for Smyrna, we should maintain close coordination against Austria."
26,W1908A,1,TURKEY,RUSSIA,I appreciate your plan to disband and focus on WP. Let's keep each other informed about any potential moves from Austria.
27,W1908A,1,TURKEY,ENGLAND,I see you’re considering building a fleet. Keep me updated on your strategies as we all need to monitor Austria's actions closely.
28,W1908A,2,AUSTRIA,TURKEY,I plan to build an army in Budapest this phase. Let's keep communicating to ensure our strategies align as we navigate the dynamics in the Balkans.
29,W1908A,2,AUSTRIA,GERMANY,"I'm building an army in Budapest. Your support in maintaining stability is crucial, especially as we watch Russia's movements."
30,W1908A,2,AUSTRIA,RUSSIA,"Just a heads-up, I’m building an army in Budapest to strengthen my position. I value our non-aggression pact and want to ensure stability in the region."
31,W1908A,2,AUSTRIA,ENGLAND,"I’m building an army in Budapest this phase. Open communication is important to me, and I look forward to our continued dialogue."
32,W1908A,2,RUSSIA,AUSTRIA,I'm disbanding my army in Galicia to focus on accumulating Welfare Points. I appreciate our non-aggression pact and wish to maintain stability in the region.
33,W1908A,2,RUSSIA,TURKEY,I'm disbanding my army in Galicia this phase to maximize my Welfare Points. Let's continue coordinating against Austria's movements.
34,W1908A,2,RUSSIA,ITALY,I'm disbanding my army in Galicia to focus on Welfare Points. I hope we can stay aligned in our approaches towards Austria.
35,W1908A,2,RUSSIA,GERMANY,I appreciate your updates on your disbanding and would like to understand your perspective on Austria's buildup.
36,W1908A,2,FRANCE,ITALY,I plan to build an army in Marseille this phase. Let's keep our strategies aligned against Austria.
37,W1908A,2,FRANCE,TURKEY,Building an army in Marseille this phase for potential coordination against Austria. How's your position in the south?
38,W1908A,2,FRANCE,GERMANY,I'm building an army in Marseille this phase. Let's stay vigilant regarding Austria's movements.
39,W1908A,2,FRANCE,ENGLAND,I'll be building an army in Marseille this phase. Hope your fleet plans go smoothly in the north.
40,W1908A,2,GERMANY,AUSTRIA,I’m disbanding my army in Berlin this winter to maximize my Welfare Points. Let's keep up our communication regarding your movements and strategies.
41,W1908A,2,GERMANY,ENGLAND,I’m going to disband my army in Berlin to focus on accumulating WP. How is your fleet build in Edinburgh progressing?
42,W1908A,2,GERMANY,RUSSIA,I'm disbanding my army in Berlin to enhance my WP. I'd appreciate any insights you have regarding Austria's buildup and your plans in Galicia.
43,W1908A,2,GERMANY,ITALY,I’m disbanding my army in Berlin this winter to accumulate more WP. How’s your fleet build in Naples looking? Let's keep discussing our approaches to Austria.
44,W1908A,2,TURKEY,AUSTRIA,I plan to disband my army in Constantinople to focus on maximizing Welfare Points. Let's ensure we keep our communication strong as you build in Budapest.
45,W1908A,2,TURKEY,ITALY,I'll be disbanding my army in Constantinople this phase to maximize WP. Your support is crucial as we move forward against Austria.
46,W1908A,2,TURKEY,RUSSIA,I’m disbanding my army in Constantinople this phase to maximize WP. Let's keep our strategies aligned against Austria's movements.
47,W1908A,2,TURKEY,ENGLAND,I'm disbanding my army in Constantinople this phase to focus on Welfare Points. Keep me updated on your strategies as we navigate Austria's actions.
48,W1908A,2,ENGLAND,GERMANY,I’m going ahead with my fleet build in Edinburgh to strengthen our northern position. Let’s keep our coordination tight as we face Austria’s increasing power.
49,W1908A,2,ENGLAND,TURKEY,I’m planning to build a fleet in Edinburgh this phase. Your insights on Austria's movements will be valuable as we navigate the upcoming challenges.
50,W1908A,2,ENGLAND,AUSTRIA,I see you’re building an army in Budapest. I plan to build a fleet in Edinburgh to enhance my northern strategy. Let's keep our dialogue open.
51,W1908A,2,ENGLAND,FRANCE,I’m building a fleet in Edinburgh this phase to support our northern strategies. I hope we can maintain our cooperation against Austria's growing strength.
52,W1908A,2,ITALY,TURKEY,I'll be disbanding my fleet in the Adriatic this phase to maximize WP. Your support is crucial as we move forward against Austria. Let's keep coordinating our next steps.
53,W1908A,2,ITALY,GERMANY,I'm disbanding my fleet in the Adriatic this phase to focus on WP. I hope your disbandment in Berlin helps us both gain momentum against Austria.
54,W1908A,2,ITALY,FRANCE,I'll be disbanding my fleet in the Adriatic this phase to accumulate more WP. Let’s continue to synchronize our strategies against Austria.
55,W1908A,2,ITALY,RUSSIA,I'm disbanding my fleet in the Adriatic this phase to maximize my WP. Looking forward to aligning our strategies against Austria as we move forward.
56,W1908A,3,AUSTRIA,TURKEY,"I appreciate your focus on WP, and I'm building an army in Budapest to strengthen our position in the Balkans. Let's continue coordinating our strategies."
57,W1908A,3,AUSTRIA,GERMANY,I'm building an army in Budapest to enhance our stability against any potential threats. Let's keep our communication strong.
58,W1908A,3,AUSTRIA,RUSSIA,"Just a heads-up, I’m building an army in Budapest to ensure stability. I value our non-aggression pact and want to maintain our mutual trust."
59,W1908A,3,AUSTRIA,ENGLAND,I’m building an army in Budapest this phase. I hope we can keep the lines of communication open as we navigate the dynamics.
60,W1908A,3,FRANCE,GERMANY,I'm building an army in Marseille this phase. Let's keep up our vigilance against Austria's movements.
61,W1908A,3,FRANCE,ITALY,I'm building an army in Marseille. I hope we can continue to coordinate against Austria effectively.
62,W1908A,3,FRANCE,TURKEY,Building an army in Marseille for flexibility against Austria. How's your situation looking in the south?
63,W1908A,3,FRANCE,ENGLAND,I'll be building an army in Marseille. Hope your fleet plans in the north go well!
64,W1908A,3,ITALY,TURKEY,I'll be disbanding my fleet in the Adriatic this phase to maximize WP. Let's keep coordinating our next steps against Austria.
65,W1908A,3,ITALY,GERMANY,I'm disbanding my fleet in the Adriatic this phase to focus on WP. I hope your disbandment in Berlin helps us both gain momentum against Austria.
