,phase,round,sender,recipient,message
17,F1903M,1,AUSTRIA,TURKEY,"I appreciate our continued dialogue, Turkey. I'm moving to Galicia to secure our interests against Russia. Let's keep coordinating our strategies."
18,F1903M,1,AUSTRIA,GERMANY,"Germany, I'm moving to Galicia as planned. Let's ensure we maintain a strong front against Russia. How are your own movements progressing?"
19,F1903M,1,AUSTRIA,ENGLAND,"England, I'm advancing to Galicia to strengthen my position. I'm keen to hear how your strategies are developing in the North."
20,F1903M,1,RUSSIA,TURKEY,"Turkey, let's solidify our plans for Galicia and discuss how we can ensure both our interests are protected. I'm considering holding my position there while you continue to advance. What are your thoughts?"
21,F1903M,1,RUSSIA,AUSTRIA,"Austria, I see you are moving to Galicia. Let's ensure that our non-aggression pact remains intact. I plan to hold in Galicia; I hope this aligns with our previous agreements."
22,F1903M,1,RUSSIA,ITALY,"Italy, I want to maintain open lines of communication regarding Austria's movements. How do you view the current situation? I'm interested in keeping our cooperation strong."
23,F1903M,1,RUSSIA,GERMANY,"Germany, I'm curious about your plans regarding the movements towards Belgium. It would be good to understand your perspective as the situation in the west evolves."
24,F1903M,2,FRANCE,GERMANY,"Hey Germany, I see we're both interested in Belgium. How about we agree that I move in and you hold? It might be a good way to avoid conflict."
25,F1903M,2,FRANCE,ITALY,I'm moving to Belgium this turn to secure my position. How do you see the situation with Austria developing? We need to keep our plans aligned.
26,F1903M,2,FRANCE,TURKEY,Just checking in—how are you feeling about the situation in the south? Any updates on your movements would be helpful.
27,F1903M,2,FRANCE,ENGLAND,I noticed your hold in Wales. I'm moving to Belgium this turn. How do you see our cooperation shaping up in the north?
28,F1903M,2,GERMANY,FRANCE,"Hey France, just confirming that I'll be holding in Belgium if you move in. Let's coordinate our movements effectively to avoid any conflict."
29,F1903M,2,GERMANY,AUSTRIA,"Austria, I’m planning to secure Belgium this turn. Let’s keep our lines of communication open as we both deal with Russia."
30,F1903M,2,GERMANY,ENGLAND,"England, I’m moving to Belgium this turn as planned. Let’s stay coordinated in our northern strategies!"
31,F1903M,2,GERMANY,ITALY,"Italy, how's the situation in the Mediterranean? If needed, I’m willing to support you in the future."
32,F1903M,2,ITALY,TURKEY,I'm holding in Rome to maintain my defensive stance. How are your plans developing in the Balkans?
33,F1903M,2,ITALY,GERMANY,"I appreciate your offer of support. For now, I'm holding in Rome as I assess the situation with Austria."
34,F1903M,2,ITALY,FRANCE,I'm focused on holding in Rome right now. How do you see our plans against Austria aligning with your moves to Belgium?
35,F1903M,2,ITALY,RUSSIA,I'm holding my position in Rome. Let's continue to communicate about Austria's movements and ensure our strategies align.
36,F1903M,2,TURKEY,AUSTRIA,"Hey Austria, I'm holding in Rumania this turn. I think it would be wise for both of us to stay defensive for now and coordinate our moves in the Balkans. Let me know your thoughts!"
37,F1903M,2,TURKEY,RUSSIA,"Russia, I'm holding in Rumania this turn. I believe we need to ensure our movements align to avoid any misunderstandings. What are your next plans in Galicia?"
38,F1903M,2,TURKEY,ITALY,"Italy, I’m holding in Rumania for now. I want to ensure our positions are secure in the Balkans. Do you have any plans to move or hold?"
39,F1903M,2,TURKEY,FRANCE,"France, I’m holding in Rumania this turn as I consolidate my position. How do you feel about the situation in the south? Any updates on your movements?"
40,F1903M,2,RUSSIA,TURKEY,"Turkey, I'm planning to move my army to Galicia this turn to strengthen our position together. Let’s ensure we coordinate our next steps to avoid any conflicts."
41,F1903M,2,RUSSIA,AUSTRIA,"Austria, I see you're moving to Galicia. I plan to hold my position there as well, but I hope we can maintain our non-aggression pact and ensure stability in the region."
42,F1903M,2,RUSSIA,ITALY,"Italy, I’m moving my army to Galicia this turn. I want to keep communication open regarding our strategies in the face of Austria's movements."
43,F1903M,2,RUSSIA,GERMANY,"Germany, I hope to keep communication open as the situation develops in the west. I'd like to understand your thoughts on Austria's advances."
44,F1903M,2,ENGLAND,GERMANY,Let's keep each other informed as you move into Belgium. I’ll be holding in Wales to ensure we maintain our northern stability.
45,F1903M,2,ENGLAND,FRANCE,I see you're moving to Belgium as well. How do you plan to balance our interests in the North with Germany's actions?
46,F1903M,2,ENGLAND,TURKEY,I'm holding in Wales for now. Any insights on the situation in the Balkans that you can share?
47,F1903M,2,ENGLAND,AUSTRIA,How are you adapting your strategy in Galicia? I’m curious about your long-term plans.
48,F1903M,2,AUSTRIA,TURKEY,"Let's ensure our strategies align, especially regarding Galicia and our movements in the Balkans. I see you're advancing into Armenia, which could strengthen our position."
49,F1903M,2,AUSTRIA,GERMANY,I'm moving to Galicia this turn. How are your plans against Russia unfolding? It's important we remain coordinated.
50,F1903M,2,AUSTRIA,RUSSIA,I plan to occupy Galicia. Let's keep our non-aggression pact strong as we both navigate our interests there.
51,F1903M,2,AUSTRIA,ENGLAND,I'm moving to Galicia to secure my interests there. What are your plans in the North? Any updates on your strategy?
52,F1903M,3,FRANCE,GERMANY,"Let's confirm that I will move into Belgium this turn. Can we agree that you hold, ensuring we both avoid any conflict?"
53,F1903M,3,FRANCE,ITALY,How do you feel about my move to Belgium? I think it's essential to keep our coordination tight against Austria.
54,F1903M,3,FRANCE,TURKEY,Just touching base again—do you have any updates on your movements? I'm still focused on the situation in Belgium.
55,F1903M,3,FRANCE,ENGLAND,"With my move to Belgium, how do you see our plans in the north shaping up? Your hold in Wales seems solid."
56,F1903M,3,TURKEY,AUSTRIA,"Hey Austria, I'm planning to move from Rumania to Bulgaria this turn. I believe it's a good opportunity to secure that position. Let me know your thoughts!"
57,F1903M,3,TURKEY,RUSSIA,"Russia, I’m moving to Bulgaria this turn. It should help us both as we solidify our position in the region. What are your thoughts?"
58,F1903M,3,TURKEY,ITALY,"Italy, I’m moving to Bulgaria to strengthen my position. How are you planning to respond to Austria's moves? I’d love to hear your thoughts."
59,F1903M,3,TURKEY,FRANCE,"France, I'm moving to Bulgaria this turn. How do you view the current dynamics in the south? Any insights would be appreciated!"
60,F1903M,3,RUSSIA,TURKEY,"Turkey, I'm planning to hold in Galicia to strengthen our position together. Let’s ensure we coordinate our next steps to avoid conflicts."
61,F1903M,3,RUSSIA,AUSTRIA,"Austria, I intend to hold my position in Galicia as well. It's important we keep our non-aggression pact intact as we both navigate our interests."
62,F1903M,3,RUSSIA,ITALY,"Italy, just a heads-up, I’m holding in Galicia this turn. Let’s keep communicating about how we can support each other moving forward."
63,F1903M,3,RUSSIA,GERMANY,"Germany, I'm keeping a close eye on your movements. How do you see the situation evolving with Austria and France?"
64,F1903M,3,AUSTRIA,TURKEY,Let's keep communication strong regarding Galicia and your plans for Armenia. I believe our cooperation is crucial as we both advance our interests.
65,F1903M,3,AUSTRIA,GERMANY,"I'm advancing to Galicia, and I hope we can coordinate our strategies against Russia effectively. Your plans in Belgium sound promising—let's keep each other updated."
66,F1903M,3,AUSTRIA,RUSSIA,I see you plan to hold in Galicia. Let's ensure we stick to our non-aggression pact and avoid conflict while managing our interests.
67,F1903M,3,AUSTRIA,ENGLAND,"My move to Galicia is crucial for my strategy. What are your plans in the North, and how can we align our strategies?"
68,F1903M,3,GERMANY,FRANCE,I confirm that I will hold in Belgium this turn to avoid conflict. Let's ensure our movements align smoothly.
69,F1903M,3,GERMANY,AUSTRIA,I'm moving to Belgium this turn. Let's maintain our cooperation against Russia and keep each other informed.
70,F1903M,3,GERMANY,ENGLAND,"As I move to Belgium, I’ll ensure we remain coordinated in our northern strategies."
71,F1903M,3,GERMANY,ITALY,How is the situation in the Mediterranean? I'm focused on my move to Belgium now but still want to support you if needed.
72,F1903M,3,ENGLAND,GERMANY,"As you move into Belgium, let's ensure we coordinate our strategies effectively. I will be holding in Wales to maintain stability."
73,F1903M,3,ENGLAND,FRANCE,I see you're moving to Belgium. How do you propose we navigate our interests in the North given Germany's actions?
74,F1903M,3,ENGLAND,TURKEY,How are things progressing for you in the Balkans? Any updates that could help us align our strategies?
75,F1903M,3,ENGLAND,AUSTRIA,Good luck with your advance in Galicia! How are you feeling about the situation in the North as we both proceed?
76,F1903M,3,ITALY,TURKEY,I'm holding in Rome to maintain my defensive stance against Austria. I see you're moving to Bulgaria—how are our positions aligning in the Balkans? Should we coordinate further?
77,F1903M,3,ITALY,GERMANY,I'm holding in Rome for now. How are your movements to Belgium affecting your stance on Austria? I want to ensure we're aligned.
78,F1903M,3,ITALY,FRANCE,"With your move to Belgium, how do you see our plans against Austria developing? I want to ensure we're coordinated."
79,F1903M,3,ITALY,RUSSIA,I'm holding in Rome while observing Austria's actions. Let’s keep communication open regarding any threats from Austria and how we can support each other.
80,F1903M,4,AUSTRIA,TURKEY,I will hold in Galicia this turn to consolidate our position. Let's continue our coordination to ensure our plans align.
81,F1903M,4,AUSTRIA,GERMANY,I will be holding in Galicia to maintain stability. How do you feel about our joint strategies against Russia as the season progresses?
82,F1903M,4,AUSTRIA,RUSSIA,I'm holding in Galicia this turn to reinforce our non-aggression pact. I appreciate your commitment to stability in the region.
83,F1903M,4,AUSTRIA,ENGLAND,I’m holding in Galicia to ensure stability there. How are your plans shaping up in the North?
84,F1903M,4,RUSSIA,TURKEY,"Turkey, I plan to hold in Galicia this turn to solidify our position together. Let’s keep coordinating our movements to avoid any conflicts."
85,F1903M,4,RUSSIA,AUSTRIA,"Austria, I'm holding in Galicia this turn as we discussed. I appreciate your commitment to our non-aggression pact."
86,F1903M,4,RUSSIA,ITALY,"Italy, I'm holding in Galicia this turn. Let's continue to communicate regarding Austria's movements and ensure our strategies align."
87,F1903M,4,RUSSIA,GERMANY,"Germany, I'm monitoring the situation closely. How do you see Austria's movements affecting the balance in the west?"
88,F1903M,4,ENGLAND,GERMANY,I'm holding in Wales for now. Let’s keep coordinating our northern strategies. Good luck with your move into Belgium!
89,F1903M,4,ENGLAND,FRANCE,I see you're moving to Belgium. Let's make sure our interests are balanced in the North. Communication is key!
90,F1903M,4,ENGLAND,TURKEY,I’m holding in Wales this phase. Any updates on the Balkans? I’d love to hear your insights.
91,F1903M,4,ENGLAND,AUSTRIA,Good luck with your advance in Galicia! I’m holding in Wales. How’s the situation developing on your end?
92,F1903M,4,TURKEY,AUSTRIA,I'm moving from Rumania to Bulgaria this turn. Let's continue our dialogue to ensure our positions in the Balkans remain aligned.
93,F1903M,4,TURKEY,RUSSIA,I'm moving to Bulgaria this turn. I hope we can synchronize our plans as we both advance our positions. What are your thoughts?
94,F1903M,4,TURKEY,ITALY,I’m moving to Bulgaria this turn to solidify my presence. How do you see the situation developing with Austria?
95,F1903M,4,TURKEY,FRANCE,"Just to keep you in the loop, I'm moving to Bulgaria this turn. What are your views on the dynamics in the south?"
96,F1903M,4,FRANCE,GERMANY,Thanks for agreeing to hold in Belgium! Let's ensure our movements continue to align well.
97,F1903M,4,FRANCE,ITALY,I'm moving to Belgium this turn to solidify my position. How do you feel about our strategies against Austria?
98,F1903M,4,FRANCE,TURKEY,"I'm focused on the situation in Belgium. With your move to Bulgaria, how do you see the southern dynamics developing?"
99,F1903M,4,FRANCE,ENGLAND,I see we're both maintaining our positions in the north. Let's keep communication open as the situation unfolds.
100,F1903M,4,GERMANY,AUSTRIA,Let's continue coordinating our efforts against Russia while I hold in Belgium.
101,F1903M,4,GERMANY,ENGLAND,"I'll be holding in Holland this turn, keeping our northern strategies aligned."
102,F1903M,4,GERMANY,FRANCE,Thanks for agreeing to move into Belgium! I'll hold in Holland to keep the peace.
103,F1903M,4,GERMANY,ITALY,I’m holding in Holland to maintain stability. Let me know if you need anything from me!
104,F1903M,4,ITALY,TURKEY,I’m holding in Rome to deter any moves from Austria. How are your plans developing in the Balkans with your move to Bulgaria? Any coordination we should plan?
105,F1903M,4,ITALY,GERMANY,I’m holding in Rome right now. I appreciate your offer for support—let’s keep the communication open as the situation develops.
106,F1903M,4,ITALY,FRANCE,I'm holding in Rome to maintain a strong defensive position against Austria. How do you see our coordination aligning with your movements?
107,F1903M,4,ITALY,RUSSIA,I'm maintaining my position in Rome as a deterrent against Austria. Let’s keep communicating to ensure our strategies align.
0,W1903A,1,RUSSIA,AUSTRIA,"Hey Austria, just checking in on your plans. I noticed you're moving to Galicia and I want to reassure you of our non-aggression pact. Let's keep communication open to avoid any misunderstandings."
1,W1903A,1,RUSSIA,TURKEY,"Turkey, I appreciate our collaboration in the Balkans. How do you feel about continuing our joint efforts? I plan to disband my fleet in the Black Sea again this phase to keep accumulating WP."
2,W1903A,1,RUSSIA,ITALY,"Italy, I hope you're doing well. I'm interested in your thoughts about the Mediterranean and how we can maintain peace in the region, especially with Austria's moves."
3,W1903A,1,RUSSIA,GERMANY,"Germany, I saw your recent movements towards Belgium. Can we touch base about the situation in the north? I want to ensure stability as we all navigate these changing dynamics."
4,W1903A,1,ITALY,TURKEY,"Hey Turkey, how's the situation in the Balkans? I'm considering building a unit in Naples for added security. Let me know if you have any insights or plans!"
5,W1903A,1,ITALY,FRANCE,"Hi France, I'm looking at potentially building in Naples. Do you foresee any threats from Austria that I should prepare for?"
6,W1903A,1,ITALY,GERMANY,"Germany, just checking in to see how your plans are shaping up against Austria. I'm maintaining my defensive stance in Rome and considering a build in Naples for extra security."
7,W1903A,1,ITALY,RUSSIA,"Hello Russia, thanks for your previous message. I'm looking to reinforce my position in the Mediterranean, possibly by building in Naples. What are your thoughts on the region's stability?"
8,W1903A,1,FRANCE,ITALY,"Hi Italy, I'm considering disbanding my unit in Belgium to increase my Welfare Points. I believe this will help us maintain stability against Austria. How do you see the situation developing in the Mediterranean, and should I be concerned about any moves from Austria?"
9,W1903A,1,FRANCE,GERMANY,"Hey Germany, I'm planning to disband my army in Belgium to focus on accumulating Welfare Points. I hope this aligns with our mutual interest in stability. Please confirm your intentions for the area."
10,W1903A,1,FRANCE,TURKEY,"Hi Turkey, I'm planning to disband my unit in Belgium this winter to boost my Welfare Points. How do you see the situation with Austria evolving, and do you have any insights on how I can assist you?"
11,W1903A,1,FRANCE,GLOBAL,I'm interested in hearing everyone's thoughts about the upcoming movements. Let's ensure we maintain our focus on WP accumulation and cooperation.
12,W1903A,1,AUSTRIA,RUSSIA,"Hey Russia, just to confirm, I'm disbanding my unit in Vienna to focus on accumulating Welfare Points. I want to reassure you that our non-aggression pact still stands. Let's keep our communication open."
13,W1903A,1,AUSTRIA,TURKEY,"Hi Turkey, I will be disbanding my unit in Vienna this phase to accumulate Welfare Points. Just wanted to keep you in the loop. Looking forward to our continued cooperation."
14,W1903A,1,AUSTRIA,GERMANY,"Hello Germany, I'm disbanding my unit in Vienna this phase to boost my Welfare Points. Let's keep strategizing against any potential threats, especially from Russia."
15,W1903A,1,AUSTRIA,GLOBAL,I'm focusing on accumulating Welfare Points this phase by disbanding my unit in Vienna. It's crucial we maintain our alliances and communication as the dynamics in the region evolve.
16,W1903A,1,GERMANY,AUSTRIA,"Hey Austria, I see you're disbanding in Vienna. I plan to disband my Army in Munich this phase as well to boost our WP. Let's continue coordinating our strategies against Russia."
17,W1903A,1,GERMANY,FRANCE,"France, thanks for letting me know about your disbanding in Belgium. I’ll be disbanding my Army in Munich to focus on WP accumulation too. Let's keep discussing our positions to maintain stability."
18,W1903A,1,GERMANY,ITALY,"Italy, just checking in to see how your defensive plans are shaping up. I'm focusing on WP accumulation and disbanding my Army in Munich this phase. Let me know if you need support."
19,W1903A,1,GERMANY,ENGLAND,"England, I appreciate our coordination. I’m planning to disband my Army in Munich to maximize WP. How are you planning your next moves?"
20,W1903A,1,ENGLAND,GERMANY,"I appreciate our coordination thus far, and I’m planning to build a stronger position in the North. Let’s keep up our communication on future moves."
21,W1903A,1,ENGLAND,FRANCE,It looks like we both are on the same page with WP accumulation. Let’s ensure we continue to monitor each other’s movements and maintain stability in the North.
22,W1903A,1,ENGLAND,TURKEY,How are things progressing on your end in the Balkans? I’m interested in any updates as our cooperation continues.
23,W1903A,1,ENGLAND,AUSTRIA,"Your plans for disbanding sound solid. If there are any shifts in the region, let’s keep our dialogue open to adapt our strategies."
24,W1903A,1,TURKEY,AUSTRIA,"Hi Austria, great to see our cooperation continuing. With you disbanding in Vienna, do you feel secure about our borders with Russia? I'm considering building another army in Constantinople for added defense."
25,W1903A,1,TURKEY,RUSSIA,"Hey Russia, I appreciate our ongoing collaboration. With your plans to disband in the Black Sea, do you foresee any shifts in the balance of power? I'm planning to build in Constantinople to strengthen our position."
26,W1903A,1,TURKEY,ITALY,"Hi Italy, how's everything on your end? With your interest in Naples, I think building an army in Constantinople will help us maintain stability in the Balkans. Let me know if you have any thoughts!"
27,W1903A,1,TURKEY,FRANCE,"Hi France, I see you're disbanding in Belgium. Just wanted to keep you updated that I'm building in Constantinople to ensure our defense remains strong. Let me know how things are progressing for you!"
28,W1903A,2,RUSSIA,AUSTRIA,"Hey Austria, thanks for confirming your disbanding unit. I'm planning to disband my fleet in the Black Sea as well this phase to focus on WP. Let’s keep communicating as we progress."
29,W1903A,2,RUSSIA,TURKEY,"Turkey, I'm going to disband my fleet in the Black Sea this phase. I think it's vital for us to keep accumulating WP. Let's ensure we coordinate our movements effectively."
30,W1903A,2,RUSSIA,ITALY,"Italy, just wanted to touch base on our previous discussions. How do you see the Mediterranean dynamics evolving with Austria's movements? Your perspective would be helpful."
31,W1903A,2,RUSSIA,GERMANY,"Germany, I hope you're doing well. With your movements towards Belgium, I’m curious about your plans in the north. Can we discuss how we can ensure stability together?"
32,W1903A,2,ITALY,TURKEY,"Hey Turkey, I've decided to disband my unit in Rome to focus on accumulating Welfare Points. Let me know how your moves unfold in the Balkans!"
33,W1903A,2,ITALY,FRANCE,"Hi France, I'm looking to disband my army in Rome this phase to maximize my Welfare Points. How do you see the situation evolving against Austria?"
34,W1903A,2,ITALY,GERMANY,"Germany, I'm disbanding my unit in Rome to increase my WP. I'd like to stay informed about your movements against Austria. How's your position shaping up?"
35,W1903A,2,ITALY,RUSSIA,"Hello Russia, I'm going to disband my unit in Rome to focus on WP accumulation. How do you see the Mediterranean situation evolving with Austria's activity?"
36,W1903A,2,FRANCE,ITALY,"Hi Italy, I've decided to disband my army in Belgium this phase to focus on accumulating Welfare Points. I think this will help us maintain stability against Austria. Let me know if you need anything from me!"
37,W1903A,2,FRANCE,GERMANY,"Germany, I’m going to disband in Belgium to maximize my Welfare Points. I appreciate our collaboration and let's continue to communicate about our positions."
38,W1903A,2,FRANCE,TURKEY,"Turkey, I'm disbanding my unit in Belgium this winter to boost my Welfare Points. How is your strategy against Austria evolving?"
39,W1903A,2,FRANCE,GLOBAL,Just a reminder to everyone to keep focusing on Welfare Points and cooperation. It's important that we stay aligned to manage any threats effectively.
40,W1903A,2,TURKEY,AUSTRIA,"Hi Austria, I appreciate our continued cooperation. I'm planning to build an army in Constantinople this winter to enhance our defense. How do you see our positions evolving against any potential threats?"
41,W1903A,2,TURKEY,RUSSIA,"Hey Russia, I see you're also focusing on accumulating WP by disbanding your fleet. I'm building an army in Constantinople to strengthen our position in the region. Let's keep coordinating our efforts!"
42,W1903A,2,TURKEY,ITALY,"Hi Italy, I hope your plans in Naples are shaping up. I'm building an army in Constantinople to ensure stability in the Balkans. Would love to hear more about your thoughts on the situation!"
43,W1903A,2,TURKEY,FRANCE,"Hi France, thanks for the update on your disbanding in Belgium. I'm building an army in Constantinople this winter for defense purposes. How are you viewing the situation with Austria?"
44,W1903A,2,ENGLAND,GERMANY,I’m considering disbanding my army in Wales this phase to maximize Welfare Points. Let’s continue our strong coordination in the North.
45,W1903A,2,ENGLAND,FRANCE,I’m looking at disbanding my army in Wales to accumulate more Welfare Points. I believe our collaboration will strengthen our positions.
46,W1903A,2,ENGLAND,TURKEY,Just checking in on your situation in the Balkans. I’m planning to disband my army to focus on accumulating Welfare Points. Let’s keep our dialogue open.
47,W1903A,2,ENGLAND,AUSTRIA,I support your decision to disband in Vienna for WP accumulation. I’m also planning to disband my army in Wales to enhance my WP this phase.
48,W1903A,2,GERMANY,AUSTRIA,"Hey Austria, I'm planning to disband my Army in Munich this phase to boost our Welfare Points. Let's keep coordinating our strategies against Russia and ensure our positions are secure."
49,W1903A,2,GERMANY,FRANCE,"France, just confirming that I'm disbanding my Army in Munich this phase as well. I appreciate our cooperation and will keep an eye on our positions to maintain stability."
50,W1903A,2,GERMANY,ITALY,"Italy, I hope you're doing well. I'm planning to disband my Army in Munich to focus on accumulating WP. Let me know if you need anything as you prepare your defenses."
51,W1903A,2,GERMANY,ENGLAND,"England, just wanted to keep you updated that I'm disbanding my Army in Munich to maximize WP. Looking forward to our continued collaboration in the North."
52,W1903A,2,AUSTRIA,TURKEY,"Hi Turkey, I just wanted to confirm that I will be disbanding my unit in Vienna this phase to focus on accumulating WP. Looking forward to seeing how we can strengthen our cooperation moving forward."
53,W1903A,2,AUSTRIA,GERMANY,"Hello Germany, just a heads-up that I'm disbanding my army in Vienna to accumulate WP. Let’s keep discussing our strategies against Russia."
54,W1903A,2,AUSTRIA,RUSSIA,"Hey Russia, just letting you know I’m disbanding my unit in Vienna for WP. It’s great that we are on the same page with our non-aggression pact. Let’s keep in touch."
55,W1903A,2,AUSTRIA,GLOBAL,I’m focusing on WP accumulation by disbanding my unit in Vienna. I appreciate everyone’s cooperation and communication as we navigate the changing dynamics in the region.
56,W1903A,3,RUSSIA,AUSTRIA,"Hey Austria, thanks for your cooperation. Just confirming my plans to disband my fleet in the Black Sea this phase to focus on WP. Let’s keep each other updated!"
57,W1903A,3,RUSSIA,TURKEY,"Turkey, I'm going ahead with my plan to disband my fleet in the Black Sea. I'm optimistic about our continued coordination in the Balkans. Let’s keep communicating!"
